gov_supervisory_oversight_supervisory_reporting,The SFTY approach,SFTY centralizes,supervisory reporting workflows,"SFTY integrates data from multiple providers and systems into a unified supervisory layer that structures reporting workflows, links evidence to cases, and streamlines audit-ready outputs for regulators.",Connect fragmented market data,Turn signals into supervisory cases,Preserve evidence and decision history,Support reporting across agencies,VASP Data,Licensing,Travel Rule,KYT,OSINT,SFTY Supervisory Control Layer,Alerts,Cases,Supervisory Actions,Reports
gov_supervisory_oversight_supervisory_workflows,Supervisory layer,SFTY builds one,supervisory operating layer,"SFTY connects VASP and CASP data, licensing records, wallet and transaction activity, alerts, cases and evidence into a single platform that supports structured supervisory workflows and audit-ready reporting.",Connect fragmented market data,Turn signals into supervisory cases,Preserve evidence and decision history,Support reporting across agencies,VASP Data,Licensing,Travel Rule,KYT,OSINT,SFTY Supervisory Control Layer,Alerts,Cases,Supervisory Actions,Reports
gov_supervisory_oversight_supervisory_operating_layer,Government solution,SFTY creates one,supervisory operating layer,"SFTY connects data from VASPs, CASPs, licensing, transactions and alerts into a unified supervisory layer that supports real-time risk assessment, case management and evidence traceability for regulators.",Connect fragmented market data,Turn signals into supervisory cases,Preserve evidence and decision history,Support reporting across agencies,VASP Data,Licensing,Travel Rule,KYT,OSINT,SFTY Supervisory Control Layer,Alerts,Cases,Supervisory Actions,Reports
gov_supervisory_oversight_market_visibility,Market oversight layer,SFTY gives regulators,market-level visibility,"SFTY connects VASP profiles, wallet and transaction data, risk signals, cases and supervisory actions into one secure operating layer for clearer and more efficient oversight of the digital asset market.",Connect fragmented market data,Turn signals into supervisory cases,Preserve evidence and decision history,Support reporting across agencies,VASP Data,Licensing,Travel Rule,KYT,OSINT,SFTY Supervisory Control Layer,Alerts,Cases,Supervisory Actions,Reports
gov_supervisory_oversight_multi_entity_monitoring,Connected supervision,SFTY gives regulators,a connected supervisory layer,"SFTY integrates data from multiple VASPs, licensing records, wallets, and transactions into one unified supervisory platform to streamline risk assessment, case management, and evidence-based oversight workflows.",Connect fragmented market data,Turn signals into supervisory cases,Preserve evidence and decision history,Support reporting across agencies,VASP Data,Licensing,Travel Rule,KYT,OSINT,SFTY Supervisory Control Layer,Alerts,Cases,Supervisory Actions,Reports
gov_supervisory_oversight_licensing_framework,The SFTY approach,SFTY links licensing,to market activity,"SFTY connects licensing data, regulated entity profiles, wallet and transaction activity, and risk signals into one supervisory layer so regulators can manage evidence-based workflows efficiently.",Connect fragmented market data,Turn signals into supervisory cases,Preserve evidence and decision history,Support reporting across agencies,VASP Data,Licensing,Travel Rule,KYT,OSINT,SFTY Supervisory Control Layer,Alerts,Cases,Supervisory Actions,Reports
gov_supervisory_oversight_risk_based_supervision,Supervisory layer,SFTY connects VASP,data into supervision,"SFTY integrates VASP and CASP profiles, licensing, wallet activity, risk signals and alerts into one supervisory layer that structures cases, evidence and workflows for clearer regulatory oversight.",Connect fragmented market data,Turn signals into supervisory cases,Preserve evidence and decision history,Support reporting across agencies,VASP Data,Licensing,Travel Rule,KYT,OSINT,SFTY Supervisory Control Layer,Alerts,Cases,Supervisory Actions,Reports
gov_supervisory_oversight_regulatory_decision_support,Government solution,SFTY creates one,supervisory operating layer,"SFTY connects licensing data, wallet activity, transaction records, case evidence and provider outputs into a unified supervisory layer that supports regulators’ risk-based decisions and audit-ready workflows.",Connect fragmented market data,Turn signals into supervisory cases,Preserve evidence and decision history,Support reporting across agencies,VASP Data,Licensing,Travel Rule,KYT,OSINT,SFTY Supervisory Control Layer,Alerts,Cases,Supervisory Actions,Reports
gov_supervisory_oversight_continuous_supervisory_visibility,Market oversight layer,SFTY creates one,supervisory operating layer,"SFTY integrates market participant data, risk signals, licensing records, wallet activity, cases and evidence into a connected supervisory environment that streamlines oversight and supports continuous regulatory workflows.",Connect fragmented market data,Turn signals into supervisory cases,Preserve evidence and decision history,Support reporting across agencies,VASP Data,Licensing,Travel Rule,KYT,OSINT,SFTY Supervisory Control Layer,Alerts,Cases,Supervisory Actions,Reports
gov_supervisory_oversight_evidence_escalation_layer,Connected supervision,SFTY creates one,supervisory evidence layer,"SFTY connects alerts, cases, entity data and transaction activity into a unified evidence layer that supports regulators in managing escalation workflows with traceability and audit-grade documentation.",Connect fragmented market data,Turn signals into supervisory cases,Preserve evidence and decision history,Support reporting across agencies,VASP Data,Licensing,Travel Rule,KYT,OSINT,SFTY Supervisory Control Layer,Alerts,Cases,Supervisory Actions,Reports
gov_supervisory_oversight_supervisory_dashboard,The SFTY approach,SFTY connects market,data into supervision,"SFTY organizes fragmented VASP and CASP data, wallet activity, risk signals, cases and evidence into a unified supervisory operating layer for regulators to gain clear market visibility and efficient workflows.",Connect fragmented market data,Turn signals into supervisory cases,Preserve evidence and decision history,Support reporting across agencies,VASP Data,Licensing,Travel Rule,KYT,OSINT,SFTY Supervisory Control Layer,Alerts,Cases,Supervisory Actions,Reports
gov_supervisory_oversight_vasp_oversight,Supervisory layer,SFTY creates one,supervisory operating layer,"SFTY connects VASP profiles, licensing data, wallet activity, risk signals, alerts and cases into a unified supervisory workflow that supports evidence collection, risk prioritization and regulatory reporting.",Connect fragmented market data,Turn signals into supervisory cases,Preserve evidence and decision history,Support reporting across agencies,VASP Data,Licensing,Travel Rule,KYT,OSINT,SFTY Supervisory Control Layer,Alerts,Cases,Supervisory Actions,Reports
gov_travel_rule_and_transaction_monitoring_suspicious_activity,Government solution,SFTY connects signals,into supervisory cases,"SFTY integrates Travel Rule data, wallet risk alerts and KYT signals into a unified case management workflow that supports evidence collection, escalation and regulatory review for suspicious activity.",Connect fragmented market data,Turn signals into supervisory cases,Preserve evidence and decision history,Support reporting across agencies,VASP Data,Licensing,Travel Rule,KYT,OSINT,SFTY Supervisory Control Layer,Alerts,Cases,Supervisory Actions,Reports
gov_travel_rule_and_transaction_monitoring_wallet_tracking,Market oversight layer,SFTY links wallet,activity to entities,"SFTY connects wallet actions, Travel Rule messages, supervised entity profiles and KYT signals into one structured supervisory layer that streamlines risk analysis, case creation and evidence preservation.",Connect fragmented market data,Turn signals into supervisory cases,Preserve evidence and decision history,Support reporting across agencies,VASP Data,Licensing,Travel Rule,KYT,OSINT,SFTY Supervisory Control Layer,Alerts,Cases,Supervisory Actions,Reports
gov_travel_rule_and_transaction_monitoring_ivms101_message_review,Connected supervision,SFTY connects IVMS101,messages to cases,"SFTY links Travel Rule message data, exception workflows, VASP profiles and transaction risk to create a consolidated supervisory layer with full audit evidence and traceable case management.",Connect fragmented market data,Turn signals into supervisory cases,Preserve evidence and decision history,Support reporting across agencies,VASP Data,Licensing,Travel Rule,KYT,OSINT,SFTY Supervisory Control Layer,Alerts,Cases,Supervisory Actions,Reports
gov_travel_rule_and_transaction_monitoring_sanctions_screening,The SFTY approach,SFTY connects sanctions,risk to supervisory cases,"SFTY integrates Travel Rule data, wallet and transaction monitoring, and KYT signals into connected cases that support regulators in detecting, reviewing, and documenting sanctions exposure efficiently.",Connect fragmented market data,Turn signals into supervisory cases,Preserve evidence and decision history,Support reporting across agencies,VASP Data,Licensing,Travel Rule,KYT,OSINT,SFTY Supervisory Control Layer,Alerts,Cases,Supervisory Actions,Reports
gov_travel_rule_and_transaction_monitoring_transaction_visibility,Supervisory layer,SFTY connects transaction,data to supervisory cases,"SFTY integrates transaction records, Travel Rule information, wallet risk signals and regulatory data into a unified case management workflow for clear supervisory visibility and audit-ready evidence preservation.",Connect fragmented market data,Turn signals into supervisory cases,Preserve evidence and decision history,Support reporting across agencies,VASP Data,Licensing,Travel Rule,KYT,OSINT,SFTY Supervisory Control Layer,Alerts,Cases,Supervisory Actions,Reports
gov_travel_rule_and_transaction_monitoring_cross_border_flows,Government solution,SFTY connects cross-border,data into supervisory workflows,"SFTY aggregates Travel Rule messages, transaction risk signals, wallet activity and provider outputs into one evidence-ready supervisory workflow that supports regulator review, case management and reporting across jurisdictions.",Connect fragmented market data,Turn signals into supervisory cases,Preserve evidence and decision history,Support reporting across agencies,VASP Data,Licensing,Travel Rule,KYT,OSINT,SFTY Supervisory Control Layer,Alerts,Cases,Supervisory Actions,Reports
gov_travel_rule_and_transaction_monitoring_transaction_investigation,Market oversight layer,SFTY connects Travel Rule,data into cases,"SFTY links Travel Rule messages, wallet activity, KYT signals and entity profiles into structured cases so regulators can conduct transaction investigations with complete, audit-ready evidence and clear workflows.",Connect fragmented market data,Turn signals into supervisory cases,Preserve evidence and decision history,Support reporting across agencies,VASP Data,Licensing,Travel Rule,KYT,OSINT,SFTY Supervisory Control Layer,Alerts,Cases,Supervisory Actions,Reports
gov_travel_rule_and_transaction_monitoring_counterparty_verification,Connected supervision,SFTY connects counterparty,data into cases,"SFTY integrates originator and beneficiary details with transaction risk signals, Travel Rule data, and case workflows to provide regulators a unified supervisory view supported by audit-ready evidence.",Connect fragmented market data,Turn signals into supervisory cases,Preserve evidence and decision history,Support reporting across agencies,VASP Data,Licensing,Travel Rule,KYT,OSINT,SFTY Supervisory Control Layer,Alerts,Cases,Supervisory Actions,Reports
gov_travel_rule_and_transaction_monitoring_real_time_alerting,The SFTY approach,SFTY connects real-time,alerts to cases,"SFTY integrates Travel Rule and transaction signals into a unified supervisory workflow that links alerts, case context, risk data and review actions for faster, coordinated regulatory response.",Connect fragmented market data,Turn signals into supervisory cases,Preserve evidence and decision history,Support reporting across agencies,VASP Data,Licensing,Travel Rule,KYT,OSINT,SFTY Supervisory Control Layer,Alerts,Cases,Supervisory Actions,Reports
gov_travel_rule_and_transaction_monitoring_risk_scoring,Supervisory layer,SFTY organizes Travel Rule,risk into supervisory cases,"SFTY connects Travel Rule messages, wallet risk scores, KYT signals and transaction data into one structured workflow that enables regulators to prioritize and manage risk with clear supervisory context.",Connect fragmented market data,Turn signals into supervisory cases,Preserve evidence and decision history,Support reporting across agencies,VASP Data,Licensing,Travel Rule,KYT,OSINT,SFTY Supervisory Control Layer,Alerts,Cases,Supervisory Actions,Reports
gov_travel_rule_and_transaction_monitoring_vasp_messaging,Government solution,SFTY links Travel Rule,messages to supervision,"SFTY connects Travel Rule messages with transaction data, wallet and entity context, and supervisory cases to give regulators a unified, traceable, and evidence-ready operating environment for oversight.",Connect fragmented market data,Turn signals into supervisory cases,Preserve evidence and decision history,Support reporting across agencies,VASP Data,Licensing,Travel Rule,KYT,OSINT,SFTY Supervisory Control Layer,Alerts,Cases,Supervisory Actions,Reports
gov_travel_rule_and_transaction_monitoring_data_exchange,Market oversight layer,SFTY connects fragmented,Travel Rule data flows,"SFTY integrates Travel Rule messages, wallet and transaction risk, provider outputs, and supervisory cases into a unified workflow that supports consistent review and evidence logging for regulators.",Connect fragmented market data,Turn signals into supervisory cases,Preserve evidence and decision history,Support reporting across agencies,VASP Data,Licensing,Travel Rule,KYT,OSINT,SFTY Supervisory Control Layer,Alerts,Cases,Supervisory Actions,Reports
gov_fiu_aml_intelligence_digital_asset_intelligence,Connected supervision,SFTY links VASP,data into investigations,"SFTY connects VASP records, wallet activity, ownership information, risk alerts and case histories into a unified workflow that supports FIUs’ investigation readiness and evidence-based supervisory actions.",Connect fragmented market data,Turn signals into supervisory cases,Preserve evidence and decision history,Support reporting across agencies,VASP Data,Licensing,Travel Rule,KYT,OSINT,SFTY Supervisory Control Layer,Alerts,Cases,Supervisory Actions,Reports
gov_fiu_aml_intelligence_suspicious_transaction_reporting,The SFTY approach,SFTY connects suspicious,transaction signals to cases,"SFTY links fragmented alerts, VASP profiles, ownership data and investigative workflows into one structured environment for FIUs to efficiently review suspicious transactions and prepare audit-ready reporting evidence.",Connect fragmented market data,Turn signals into supervisory cases,Preserve evidence and decision history,Support reporting across agencies,VASP Data,Licensing,Travel Rule,KYT,OSINT,SFTY Supervisory Control Layer,Alerts,Cases,Supervisory Actions,Reports
gov_fiu_aml_intelligence_digital_asset_evidence_package,Supervisory layer,SFTY structures FIU,evidence into packages,"SFTY connects provider data, case records, supervisory actions and decision logs into one structured evidence package that supports FIU teams with clear, audit-ready documentation for reporting and review.",Connect fragmented market data,Turn signals into supervisory cases,Preserve evidence and decision history,Support reporting across agencies,VASP Data,Licensing,Travel Rule,KYT,OSINT,SFTY Supervisory Control Layer,Alerts,Cases,Supervisory Actions,Reports
gov_fiu_aml_intelligence_crypto_sar_str_reporting,Government solution,SFTY organizes fragmented,data into supervisory workflows,"SFTY connects wallet activity, VASP profiles, risk signals, and case evidence into one structured workflow that supports FIU teams in streamlined suspicious activity investigation and report preparation.",Connect fragmented market data,Turn signals into supervisory cases,Preserve evidence and decision history,Support reporting across agencies,VASP Data,Licensing,Travel Rule,KYT,OSINT,SFTY Supervisory Control Layer,Alerts,Cases,Supervisory Actions,Reports
gov_fiu_aml_intelligence_aml_case_management,Market oversight layer,SFTY connects alerts,into structured cases,"SFTY organizes fragmented alerts, wallet activity, VASP data and investigative evidence into one linked case workflow, enabling FIU teams to manage reviews and reporting with clear audit trails.",Connect fragmented market data,Turn signals into supervisory cases,Preserve evidence and decision history,Support reporting across agencies,VASP Data,Licensing,Travel Rule,KYT,OSINT,SFTY Supervisory Control Layer,Alerts,Cases,Supervisory Actions,Reports
gov_fiu_aml_intelligence_goaml_integration,Connected supervision,SFTY connects case,evidence to workflows,"SFTY integrates digital asset data, risk signals and investigative evidence into unified case workflows so FIU teams can prepare SAR/STR reports efficiently with audit-ready regulatory packages.",Connect fragmented market data,Turn signals into supervisory cases,Preserve evidence and decision history,Support reporting across agencies,VASP Data,Licensing,Travel Rule,KYT,OSINT,SFTY Supervisory Control Layer,Alerts,Cases,Supervisory Actions,Reports
gov_aml_fiu_infrastructure_alert_management,The SFTY approach,SFTY connects alert,signals into cases,"SFTY integrates suspicious activity alerts with case management, evidence collection and reporting workflows to give regulators one streamlined supervisory environment for timely, coordinated FIU action.",Connect fragmented market data,Turn signals into supervisory cases,Preserve evidence and decision history,Support reporting across agencies,VASP Data,Licensing,Travel Rule,KYT,OSINT,SFTY Supervisory Control Layer,Alerts,Cases,Supervisory Actions,Reports
gov_aml_fiu_infrastructure_investigation_workflows,Supervisory layer,SFTY structures,AML investigation workflows,"SFTY connects suspicious activity signals, case evidence, reviewer actions and reporting data into one secure workflow designed to support traceable, timely and defensible FIU investigations.",Connect fragmented market data,Turn signals into supervisory cases,Preserve evidence and decision history,Support reporting across agencies,VASP Data,Licensing,Travel Rule,KYT,OSINT,SFTY Supervisory Control Layer,Alerts,Cases,Supervisory Actions,Reports
gov_aml_fiu_infrastructure_entity_risk_analysis,Government solution,SFTY connects entity,risk data into cases,"SFTY integrates fragmented entity data, risk signals and provider outputs into consolidated supervisory cases, enabling regulators to assemble evidence-ready files and streamline FIU investigative workflows.",Connect fragmented market data,Turn signals into supervisory cases,Preserve evidence and decision history,Support reporting across agencies,VASP Data,Licensing,Travel Rule,KYT,OSINT,SFTY Supervisory Control Layer,Alerts,Cases,Supervisory Actions,Reports
gov_aml_fiu_infrastructure_compliance_escalation,Market oversight layer,SFTY connects case,workflows to evidence,"SFTY integrates suspicious activity signals, supervisory decisions, and case documentation into one structured workflow so regulators can escalate compliance issues with clear audit trails and coordinated oversight.",Connect fragmented market data,Turn signals into supervisory cases,Preserve evidence and decision history,Support reporting across agencies,VASP Data,Licensing,Travel Rule,KYT,OSINT,SFTY Supervisory Control Layer,Alerts,Cases,Supervisory Actions,Reports
gov_aml_fiu_infrastructure_enforcement_actions,Connected supervision,SFTY structures enforcement,action case workflows,"SFTY connects supervisory alerts, case records, decisions and evidence into one audit-ready workflow that streamlines enforcement action readiness for financial intelligence units and regulators.",Connect fragmented market data,Turn signals into supervisory cases,Preserve evidence and decision history,Support reporting across agencies,VASP Data,Licensing,Travel Rule,KYT,OSINT,SFTY Supervisory Control Layer,Alerts,Cases,Supervisory Actions,Reports
gov_aml_fiu_infrastructure_data_aggregation,The SFTY approach,SFTY creates one,supervisory evidence layer,"SFTY connects suspicious activity, licensing, transaction and identity data into a unified supervisory evidence layer that supports FIU workflows, case management, and regulatory reporting in a single secure platform.",Connect fragmented market data,Turn signals into supervisory cases,Preserve evidence and decision history,Support reporting across agencies,VASP Data,Licensing,Travel Rule,KYT,OSINT,SFTY Supervisory Control Layer,Alerts,Cases,Supervisory Actions,Reports
gov_aml_fiu_infrastructure_aml_authority_oversight,Supervisory layer,SFTY creates one,compliance operating layer,"SFTY structures suspicious activity data, case evidence and multi-provider inputs into a unified workflow that accelerates AML investigations and supports defensible FIU reporting and supervisory oversight.",Connect fragmented market data,Turn signals into supervisory cases,Preserve evidence and decision history,Support reporting across agencies,VASP Data,Licensing,Travel Rule,KYT,OSINT,SFTY Supervisory Control Layer,Alerts,Cases,Supervisory Actions,Reports
gov_aml_fiu_infrastructure_audit_ready_logs,Government solution,SFTY structures audit,ready case workflows,"SFTY centralizes AML data, links suspicious activity signals with case evidence, preserves comprehensive audit trails, and organizes reporting workflows so regulators can manage investigation-ready records with clear traceability.",Connect fragmented market data,Turn signals into supervisory cases,Preserve evidence and decision history,Support reporting across agencies,VASP Data,Licensing,Travel Rule,KYT,OSINT,SFTY Supervisory Control Layer,Alerts,Cases,Supervisory Actions,Reports
gov_aml_fiu_infrastructure_reporting_pipeline,Market oversight layer,SFTY organizes risk,signals into reports,"SFTY connects fragmented risk signals, case evidence and supervisory reviews into one structured reporting workflow that supports audit-ready suspicious activity reporting and timely FIU regulatory outputs.",Connect fragmented market data,Turn signals into supervisory cases,Preserve evidence and decision history,Support reporting across agencies,VASP Data,Licensing,Travel Rule,KYT,OSINT,SFTY Supervisory Control Layer,Alerts,Cases,Supervisory Actions,Reports
gov_emerging_asset_supervision_tokenized_assets_supervision,Connected supervision,SFTY creates one,supervisory operating layer,"SFTY integrates tokenized asset activity, participant profiles, ownership data, transaction signals and supervisory cases into a connected workflow that enables regulators to analyze risk and prepare evidence-based reports efficiently.",Connect fragmented market data,Turn signals into supervisory cases,Preserve evidence and decision history,Support reporting across agencies,VASP Data,Licensing,Travel Rule,KYT,OSINT,SFTY Supervisory Control Layer,Alerts,Cases,Supervisory Actions,Reports
gov_emerging_asset_supervision_tokenized_securities_compliance,The SFTY approach,SFTY delivers one,supervisory operating layer,"SFTY integrates tokenized securities transactions, entity profiles, case workflows and reporting data into a single platform that streamlines oversight and preserves evidence for regulators managing emerging digital asset markets.",Connect fragmented market data,Turn signals into supervisory cases,Preserve evidence and decision history,Support reporting across agencies,VASP Data,Licensing,Travel Rule,KYT,OSINT,SFTY Supervisory Control Layer,Alerts,Cases,Supervisory Actions,Reports
gov_emerging_asset_supervision_cbdc_compliance_monitoring,Supervisory layer,SFTY connects transaction,and supervisory data,"SFTY integrates CBDC transactions, risk signals, policy data and supervisory workflows into one auditable operating layer enabling regulators to monitor activity, manage investigations and prepare compliance evidence.",Connect fragmented market data,Turn signals into supervisory cases,Preserve evidence and decision history,Support reporting across agencies,VASP Data,Licensing,Travel Rule,KYT,OSINT,SFTY Supervisory Control Layer,Alerts,Cases,Supervisory Actions,Reports
gov_emerging_asset_supervision_stablecoin_supervision,Government solution,SFTY connects stablecoin,data into oversight,"SFTY integrates issuer profiles, wallet activity, transaction signals and risk alerts into a unified supervisory workflow that supports case management, evidence logging and reporting for stablecoin regulators.",Connect fragmented market data,Turn signals into supervisory cases,Preserve evidence and decision history,Support reporting across agencies,VASP Data,Licensing,Travel Rule,KYT,OSINT,SFTY Supervisory Control Layer,Alerts,Cases,Supervisory Actions,Reports
gov_emerging_asset_supervision_rwa_market_supervision,Market oversight layer,SFTY connects tokenized,asset data layers,"SFTY integrates fragmented RWA and tokenized asset data with licensing, wallet activity, risk signals, cases, and reporting into one secure supervisory layer for government oversight and evidence-based actions.",Connect fragmented market data,Turn signals into supervisory cases,Preserve evidence and decision history,Support reporting across agencies,VASP Data,Licensing,Travel Rule,KYT,OSINT,SFTY Supervisory Control Layer,Alerts,Cases,Supervisory Actions,Reports
