biz_kyt_transaction_monitoring_blockchain_analytics_workflow_blockchain_analytics_case_management,Provider orchestration,SFTY connects blockchain,analytics risk to cases,"SFTY integrates wallet risk signals, transaction data and provider alerts into a unified case workflow, enabling VASP compliance teams to review, document and audit blockchain analytics with clear traceability.",Orchestrate provider outputs,Apply risk rules and policies,Track regulatory rule updates,Build audit-ready evidence,Travel Rule,KYB,Screening,KYT,KYC,SFTY Compliance Control Layer,Cases,Decisions,Evidence,Reports
biz_kyt_transaction_monitoring_sanctions_exposure_wallet_sanctions_exposure,Workflow control,SFTY links wallet,sanctions risk context,"SFTY connects wallet sanctions alerts to customer and counterparty profiles while aggregating transaction risk, review actions, cases and audit evidence into one clear operational workflow for compliance teams.",Orchestrate provider outputs,Apply risk rules and policies,Track regulatory rule updates,Build audit-ready evidence,Travel Rule,KYB,Screening,KYT,KYC,SFTY Compliance Control Layer,Cases,Decisions,Evidence,Reports
biz_kyt_transaction_monitoring_risk_score_aggregation_risk_score_audit_trail,The SFTY approach,SFTY preserves risk,score decision evidence,"SFTY centralizes KYT and transaction risk scores from multiple providers, linking them to case workflows, decision logs and audit evidence so compliance teams maintain a complete and verifiable risk trail.",Orchestrate provider outputs,Apply risk rules and policies,Track regulatory rule updates,Build audit-ready evidence,Travel Rule,KYB,Screening,KYT,KYC,SFTY Compliance Control Layer,Cases,Decisions,Evidence,Reports
biz_kyt_transaction_monitoring_destination_of_funds_destination_of_funds_case_management,Compliance layer,SFTY routes destination,risk alerts into cases,"SFTY aggregates destination-of-funds alerts, wallet and transaction risk data into structured cases with linked evidence and reviewer workflows to streamline suspicious flow investigations and support audit readiness.",Orchestrate provider outputs,Apply risk rules and policies,Track regulatory rule updates,Build audit-ready evidence,Travel Rule,KYB,Screening,KYT,KYC,SFTY Compliance Control Layer,Cases,Decisions,Evidence,Reports
biz_kyt_transaction_monitoring_suspicious_activity_suspicious_activity_escalation,Business solution,SFTY routes suspicious,activity into cases,"SFTY connects wallet risk alerts, transaction data and sanctions exposures into structured cases with linked evidence and workflow routing to streamline escalation and support audit-ready suspicious activity reviews.",Orchestrate provider outputs,Apply risk rules and policies,Track regulatory rule updates,Build audit-ready evidence,Travel Rule,KYB,Screening,KYT,KYC,SFTY Compliance Control Layer,Cases,Decisions,Evidence,Reports
biz_kyt_transaction_monitoring_risk_score_aggregation_risk_score_normalization,Provider orchestration,SFTY normalizes multiple,risk scores into workflow,"SFTY aggregates wallet and transaction risk signals from diverse providers, linking them to customers, transactions and cases in one unified workflow for consistent and efficient compliance review.",Orchestrate provider outputs,Apply risk rules and policies,Track regulatory rule updates,Build audit-ready evidence,Travel Rule,KYB,Screening,KYT,KYC,SFTY Compliance Control Layer,Cases,Decisions,Evidence,Reports
biz_kyt_transaction_monitoring_sanctions_exposure_transaction_sanctions_exposure,Workflow control,SFTY connects wallet,risk to cases,"SFTY links wallet and transaction risk data with sanctions alerts, provider outputs and customer profiles to create consolidated case workflows that support timely review and audit-ready evidence for compliance teams.",Orchestrate provider outputs,Apply risk rules and policies,Track regulatory rule updates,Build audit-ready evidence,Travel Rule,KYB,Screening,KYT,KYC,SFTY Compliance Control Layer,Cases,Decisions,Evidence,Reports
biz_kyt_transaction_monitoring_sanctions_exposure_high_risk_sanctions_exposure,The SFTY approach,SFTY links wallet,risk to cases,"SFTY connects wallet and transaction sanctions alerts, provider risk outputs, and compliance workflows into unified cases with audit-ready evidence to accelerate escalation and support timely team decisions.",Orchestrate provider outputs,Apply risk rules and policies,Track regulatory rule updates,Build audit-ready evidence,Travel Rule,KYB,Screening,KYT,KYC,SFTY Compliance Control Layer,Cases,Decisions,Evidence,Reports
biz_kyt_transaction_monitoring_alert_triage_alert_prioritization,Compliance layer,SFTY connects alert,outputs into workflow,"SFTY aggregates KYT alerts, transaction data and wallet risk signals into one unified case management workflow so compliance teams can prioritize reviews with complete risk context and audit evidence.",Orchestrate provider outputs,Apply risk rules and policies,Track regulatory rule updates,Build audit-ready evidence,Travel Rule,KYB,Screening,KYT,KYC,SFTY Compliance Control Layer,Cases,Decisions,Evidence,Reports
biz_kyt_transaction_monitoring_wallet_screening_vasp_wallet_screening,Business solution,SFTY connects wallet,risk to customer profiles,"SFTY links wallet risk signals, transaction monitoring data and customer profiles into a unified case management workflow so VASP compliance teams can review with full context and audit-ready evidence.",Orchestrate provider outputs,Apply risk rules and policies,Track regulatory rule updates,Build audit-ready evidence,Travel Rule,KYB,Screening,KYT,KYC,SFTY Compliance Control Layer,Cases,Decisions,Evidence,Reports
biz_kyt_transaction_monitoring_wallet_screening_wallet_screening_workflow,Provider orchestration,SFTY connects wallet,risk and alerts,"SFTY aggregates wallet risk scores, transaction signals and sanctions alerts into one structured workflow that links customers, counterparties and cases for clearer review and stronger audit readiness.",Orchestrate provider outputs,Apply risk rules and policies,Track regulatory rule updates,Build audit-ready evidence,Travel Rule,KYB,Screening,KYT,KYC,SFTY Compliance Control Layer,Cases,Decisions,Evidence,Reports
biz_kyt_transaction_monitoring_transaction_screening_transaction_screening_case_management,Workflow control,SFTY links transaction,alerts to case evidence,"SFTY connects transaction screening alerts with wallet, counterparty data, and provider outputs to create consolidated cases that streamline review, preserve audit-ready evidence, and support regulatory rule alignment.",Orchestrate provider outputs,Apply risk rules and policies,Track regulatory rule updates,Build audit-ready evidence,Travel Rule,KYB,Screening,KYT,KYC,SFTY Compliance Control Layer,Cases,Decisions,Evidence,Reports
biz_kyt_transaction_monitoring_transaction_screening_transaction_screening_rules,The SFTY approach,SFTY applies internal,rules to alerts,"SFTY consolidates transaction screening alerts and wallet risk signals, enforcing consistent internal rules and routing cases with full audit evidence to streamline review workflows for compliance teams.",Orchestrate provider outputs,Apply risk rules and policies,Track regulatory rule updates,Build audit-ready evidence,Travel Rule,KYB,Screening,KYT,KYC,SFTY Compliance Control Layer,Cases,Decisions,Evidence,Reports
biz_kyt_transaction_monitoring_transaction_screening_crypto_payment_screening,Compliance layer,SFTY aggregates wallet,and transaction risk,"SFTY connects wallet activity, sanctions data, risk signals and transaction details into unified cases and workflows so compliance teams can efficiently review crypto payments with complete audit evidence.",Orchestrate provider outputs,Apply risk rules and policies,Track regulatory rule updates,Build audit-ready evidence,Travel Rule,KYB,Screening,KYT,KYC,SFTY Compliance Control Layer,Cases,Decisions,Evidence,Reports
biz_kyt_transaction_monitoring_alert_triage_alert_escalation_workflow,Business solution,SFTY connects wallet,risk signals to cases,"SFTY aggregates KYT alerts, transaction risk data, wallet activity and provider outputs into structured cases with linked evidence so compliance teams can triage and escalate alerts with complete context and auditability.",Orchestrate provider outputs,Apply risk rules and policies,Track regulatory rule updates,Build audit-ready evidence,Travel Rule,KYB,Screening,KYT,KYC,SFTY Compliance Control Layer,Cases,Decisions,Evidence,Reports
biz_kyt_transaction_monitoring_alert_triage_high_risk_alert_triage,Provider orchestration,SFTY connects wallet,risk alerts to cases,"SFTY links wallet screening outputs, transaction risk signals, and sanctions exposure into a unified alert triage workflow that routes high-risk alerts into evidence-backed, reviewable cases for compliance teams.",Orchestrate provider outputs,Apply risk rules and policies,Track regulatory rule updates,Build audit-ready evidence,Travel Rule,KYB,Screening,KYT,KYC,SFTY Compliance Control Layer,Cases,Decisions,Evidence,Reports
biz_kyt_transaction_monitoring_destination_of_funds_transaction_destination_risk,Workflow control,SFTY connects transaction,destination risk workflows,"SFTY integrates destination risk signals, wallet activity, customer profiles and provider outputs into unified workflows that streamline review, preserve audit evidence and improve consistency for compliance teams.",Orchestrate provider outputs,Apply risk rules and policies,Track regulatory rule updates,Build audit-ready evidence,Travel Rule,KYB,Screening,KYT,KYC,SFTY Compliance Control Layer,Cases,Decisions,Evidence,Reports
biz_kyt_transaction_monitoring_risk_score_aggregation_provider_risk_score_aggregation,The SFTY approach,SFTY aggregates,provider risk scores,"SFTY consolidates wallet and transaction risk data from multiple KYT providers into one unified workflow, enabling compliance teams to review, triage and document alerts with clear audit evidence.",Orchestrate provider outputs,Apply risk rules and policies,Track regulatory rule updates,Build audit-ready evidence,Travel Rule,KYB,Screening,KYT,KYC,SFTY Compliance Control Layer,Cases,Decisions,Evidence,Reports
biz_kyt_transaction_monitoring_alert_triage_alert_routing_workflow,Compliance layer,SFTY routes alerts,into case workflows,"SFTY connects multi-provider wallet risk alerts, compliance queues, reviewer assignments and case escalation paths into a unified workflow that supports accurate routing and preserves audit evidence.",Orchestrate provider outputs,Apply risk rules and policies,Track regulatory rule updates,Build audit-ready evidence,Travel Rule,KYB,Screening,KYT,KYC,SFTY Compliance Control Layer,Cases,Decisions,Evidence,Reports
biz_kyt_transaction_monitoring_alert_triage_kyt_alert_triage,Business solution,SFTY aggregates wallet,risk into cases,"SFTY connects KYT alerts, wallet activity, transaction risk signals and provider outputs into unified cases, enabling compliance teams to triage alerts with clear context and structured priority workflows.",Orchestrate provider outputs,Apply risk rules and policies,Track regulatory rule updates,Build audit-ready evidence,Travel Rule,KYB,Screening,KYT,KYC,SFTY Compliance Control Layer,Cases,Decisions,Evidence,Reports
biz_kyt_transaction_monitoring_destination_of_funds_wallet_destination_risk,Provider orchestration,SFTY connects wallet,destination risk context,"SFTY connects wallet destination risk signals with customer and counterparty profiles, consolidating fragmented provider outputs into unified cases and audit-ready evidence for faster and clearer transaction risk reviews.",Orchestrate provider outputs,Apply risk rules and policies,Track regulatory rule updates,Build audit-ready evidence,Travel Rule,KYB,Screening,KYT,KYC,SFTY Compliance Control Layer,Cases,Decisions,Evidence,Reports
biz_kyt_transaction_monitoring_destination_of_funds_crypto_destination_of_funds,Workflow control,SFTY connects wallet,risk to destination,"SFTY aggregates wallet activity, transaction risk signals and provider outputs into one workflow to help compliance teams trace destination-of-funds exposures with clear audit evidence and case context.",Orchestrate provider outputs,Apply risk rules and policies,Track regulatory rule updates,Build audit-ready evidence,Travel Rule,KYB,Screening,KYT,KYC,SFTY Compliance Control Layer,Cases,Decisions,Evidence,Reports
biz_kyt_transaction_monitoring_sanctions_exposure_sanctions_exposure_monitoring_for_vasps,The SFTY approach,SFTY connects wallet,and transaction risk,"SFTY integrates wallet activity, sanctions alerts, transaction risk signals and compliance cases into one unified workflow for VASP teams to monitor sanctions exposure with clear audit evidence and traceability.",Orchestrate provider outputs,Apply risk rules and policies,Track regulatory rule updates,Build audit-ready evidence,Travel Rule,KYB,Screening,KYT,KYC,SFTY Compliance Control Layer,Cases,Decisions,Evidence,Reports
biz_kyt_transaction_monitoring_blockchain_analytics_workflow_blockchain_analytics_evidence,Compliance layer,SFTY connects wallet,risk to case evidence,"SFTY links blockchain analytics outputs, transaction risk, wallet activity and alerts into one audit-ready workflow to preserve clear evidence supporting case reviews and compliance decisions for VASPs.",Orchestrate provider outputs,Apply risk rules and policies,Track regulatory rule updates,Build audit-ready evidence,Travel Rule,KYB,Screening,KYT,KYC,SFTY Compliance Control Layer,Cases,Decisions,Evidence,Reports
biz_kyt_transaction_monitoring_destination_of_funds_high_risk_destination_review,Business solution,SFTY connects destination,risk signals to cases,"SFTY links destination-of-funds risk indicators from KYT providers into structured cases with enriched wallet and transaction context, enabling compliance teams to escalate, review and document high-risk scenarios efficiently.",Orchestrate provider outputs,Apply risk rules and policies,Track regulatory rule updates,Build audit-ready evidence,Travel Rule,KYB,Screening,KYT,KYC,SFTY Compliance Control Layer,Cases,Decisions,Evidence,Reports
biz_kyt_transaction_monitoring_source_of_funds_source_of_funds_for_exchanges,Provider orchestration,SFTY links wallet,activity to source of funds,"SFTY connects wallet behavior, transaction risk, provider alerts and customer profiles into one unified workflow so exchange compliance teams can efficiently review, document and evidence source of funds risks.",Orchestrate provider outputs,Apply risk rules and policies,Track regulatory rule updates,Build audit-ready evidence,Travel Rule,KYB,Screening,KYT,KYC,SFTY Compliance Control Layer,Cases,Decisions,Evidence,Reports
biz_kyt_transaction_monitoring_sanctions_exposure_crypto_sanctions_exposure,Workflow control,SFTY connects wallet,risk to sanctions cases,"SFTY aggregates wallet activity, transaction risk and sanctions screening outputs into a unified workflow that supports alert triage, case creation, decision tracking and audit-ready evidence for compliance teams.",Orchestrate provider outputs,Apply risk rules and policies,Track regulatory rule updates,Build audit-ready evidence,Travel Rule,KYB,Screening,KYT,KYC,SFTY Compliance Control Layer,Cases,Decisions,Evidence,Reports
biz_kyt_transaction_monitoring_alert_triage_wallet_alert_triage,The SFTY approach,SFTY routes wallet,alerts into cases,"SFTY connects wallet alerts, risk signals and customer data into structured cases with linked evidence, enabling compliance teams to prioritize reviews and maintain consistent audit trails across transactions.",Orchestrate provider outputs,Apply risk rules and policies,Track regulatory rule updates,Build audit-ready evidence,Travel Rule,KYB,Screening,KYT,KYC,SFTY Compliance Control Layer,Cases,Decisions,Evidence,Reports
biz_kyt_transaction_monitoring_transaction_screening_high_risk_transaction_screening,Compliance layer,SFTY connects transaction,risk and case workflows,"SFTY aggregates wallet and transaction risk signals with sanctions and customer data into one structured workflow that links alerts, reviews, escalation paths and audit-ready case evidence.",Orchestrate provider outputs,Apply risk rules and policies,Track regulatory rule updates,Build audit-ready evidence,Travel Rule,KYB,Screening,KYT,KYC,SFTY Compliance Control Layer,Cases,Decisions,Evidence,Reports
biz_kyt_transaction_monitoring_suspicious_activity_suspicious_transaction_activity,Business solution,SFTY connects wallet,risk into cases,"SFTY integrates wallet and transaction risk signals from multiple providers into unified cases with linked source and destination fund analysis, preserving audit evidence and supporting efficient suspicious activity review workflows.",Orchestrate provider outputs,Apply risk rules and policies,Track regulatory rule updates,Build audit-ready evidence,Travel Rule,KYB,Screening,KYT,KYC,SFTY Compliance Control Layer,Cases,Decisions,Evidence,Reports
biz_kyt_transaction_monitoring_wallet_screening_custodian_wallet_screening,Provider orchestration,SFTY connects wallet,risk to cases,"SFTY aggregates wallet screening, transaction risk, and source-of-funds signals into one unified case management workflow so custodians can efficiently assess and document on-chain compliance risks.",Orchestrate provider outputs,Apply risk rules and policies,Track regulatory rule updates,Build audit-ready evidence,Travel Rule,KYB,Screening,KYT,KYC,SFTY Compliance Control Layer,Cases,Decisions,Evidence,Reports
biz_kyt_transaction_monitoring_destination_of_funds_destination_of_funds_monitoring,Workflow control,SFTY connects wallet,and transaction data,"SFTY integrates wallet activity, transaction details and provider risk signals into unified workflows so compliance teams can monitor destination of funds with clear context and audit-ready evidence.",Orchestrate provider outputs,Apply risk rules and policies,Track regulatory rule updates,Build audit-ready evidence,Travel Rule,KYB,Screening,KYT,KYC,SFTY Compliance Control Layer,Cases,Decisions,Evidence,Reports
biz_kyt_transaction_monitoring_sanctions_exposure_sanctions_exposure_monitoring_for_exchanges,The SFTY approach,SFTY connects sanctions,alerts to transaction workflows,"SFTY links sanctions alerts with wallet and transaction risk data into one compliance workflow so exchanges can efficiently triage, investigate and document sanctions exposure with full audit evidence.",Orchestrate provider outputs,Apply risk rules and policies,Track regulatory rule updates,Build audit-ready evidence,Travel Rule,KYB,Screening,KYT,KYC,SFTY Compliance Control Layer,Cases,Decisions,Evidence,Reports
biz_kyt_transaction_monitoring_source_of_funds_source_of_funds_evidence,Compliance layer,SFTY preserves source,of funds evidence,"SFTY connects wallet activity, transaction risk, provider outputs and case decisions into a unified evidence trail, enabling compliance teams to document source of funds reviews with full traceability and audit readiness.",Orchestrate provider outputs,Apply risk rules and policies,Track regulatory rule updates,Build audit-ready evidence,Travel Rule,KYB,Screening,KYT,KYC,SFTY Compliance Control Layer,Cases,Decisions,Evidence,Reports
biz_kyt_transaction_monitoring_suspicious_activity_suspicious_activity_monitoring_for_exchanges,Business solution,SFTY connects wallet,risk to case workflows,"SFTY links wallet activity, transaction risk signals and provider alerts into unified case workflows that streamline suspicious activity reviews and preserve audit evidence for exchange compliance teams.",Orchestrate provider outputs,Apply risk rules and policies,Track regulatory rule updates,Build audit-ready evidence,Travel Rule,KYB,Screening,KYT,KYC,SFTY Compliance Control Layer,Cases,Decisions,Evidence,Reports
biz_kyt_transaction_monitoring_wallet_screening_exchange_wallet_screening,Provider orchestration,SFTY connects wallet,risk signals to cases,"SFTY aggregates wallet screening and transaction monitoring outputs into a unified workflow that links risk signals, customer data and alerts to structured cases and audit-ready evidence for exchange compliance teams.",Orchestrate provider outputs,Apply risk rules and policies,Track regulatory rule updates,Build audit-ready evidence,Travel Rule,KYB,Screening,KYT,KYC,SFTY Compliance Control Layer,Cases,Decisions,Evidence,Reports
biz_kyt_transaction_monitoring_suspicious_activity_suspicious_activity_evidence,Workflow control,SFTY links suspicious,activity to evidence,"SFTY connects transaction alerts, wallet risk data and provider outputs into structured cases with complete audit trails so compliance teams can trace and preserve suspicious activity evidence efficiently.",Orchestrate provider outputs,Apply risk rules and policies,Track regulatory rule updates,Build audit-ready evidence,Travel Rule,KYB,Screening,KYT,KYC,SFTY Compliance Control Layer,Cases,Decisions,Evidence,Reports
biz_kyc_kyb_onboarding_company_registry_checks_counterparty_registry_checks,The SFTY approach,SFTY connects counterparty,registry data into workflow,"SFTY integrates disparate company registry checks, KYC and KYB outputs into one structured onboarding workflow that supports risk-based routing, decision tracking and audit-ready evidence for compliance teams.",Orchestrate provider outputs,Apply risk rules and policies,Track regulatory rule updates,Build audit-ready evidence,Travel Rule,KYB,Screening,KYT,KYC,SFTY Compliance Control Layer,Cases,Decisions,Evidence,Reports
biz_kyc_kyb_onboarding_identity_verification_high_risk_identity_review,Compliance layer,SFTY connects high-risk,identity reviews into workflow,"SFTY integrates KYC, KYB, sanctions and adverse media provider outputs into a unified onboarding workflow that routes high-risk identity cases for manual review with full audit trail and case evidence.",Orchestrate provider outputs,Apply risk rules and policies,Track regulatory rule updates,Build audit-ready evidence,Travel Rule,KYB,Screening,KYT,KYC,SFTY Compliance Control Layer,Cases,Decisions,Evidence,Reports
biz_kyc_kyb_onboarding_company_registry_checks_company_registry_case_management,Business solution,SFTY connects registry,checks to cases,"SFTY links company registry data, mismatch alerts and provider outputs into structured cases with risk-based workflows that streamline corporate onboarding and preserve audit-ready evidence for compliance teams.",Orchestrate provider outputs,Apply risk rules and policies,Track regulatory rule updates,Build audit-ready evidence,Travel Rule,KYB,Screening,KYT,KYC,SFTY Compliance Control Layer,Cases,Decisions,Evidence,Reports
biz_kyc_kyb_onboarding_ongoing_monitoring_ongoing_monitoring_audit_trail,Provider orchestration,SFTY preserves ongoing,monitoring audit evidence,"SFTY centralizes KYC and KYB provider outputs, risk signals, case records and decision logs into one audit-ready evidence layer for consistent and traceable ongoing monitoring reviews.",Orchestrate provider outputs,Apply risk rules and policies,Track regulatory rule updates,Build audit-ready evidence,Travel Rule,KYB,Screening,KYT,KYC,SFTY Compliance Control Layer,Cases,Decisions,Evidence,Reports
biz_kyc_kyb_onboarding_document_verification_document_review_workflow,Workflow control,SFTY connects KYC,and KYB document reviews,"SFTY integrates fragmented document verification outputs into one structured onboarding workflow, enabling compliance teams to manage reviews, decisions and audit evidence with consistent traceability and reduced manual effort.",Orchestrate provider outputs,Apply risk rules and policies,Track regulatory rule updates,Build audit-ready evidence,Travel Rule,KYB,Screening,KYT,KYC,SFTY Compliance Control Layer,Cases,Decisions,Evidence,Reports
biz_kyc_kyb_onboarding_ongoing_monitoring_adverse_media_monitoring,The SFTY approach,SFTY integrates adverse,media into workflows,"SFTY connects adverse media alerts with onboarding data, ongoing monitoring actions, case management and audit evidence to help compliance teams maintain continuous due diligence and produce a clear audit trail.",Orchestrate provider outputs,Apply risk rules and policies,Track regulatory rule updates,Build audit-ready evidence,Travel Rule,KYB,Screening,KYT,KYC,SFTY Compliance Control Layer,Cases,Decisions,Evidence,Reports
biz_kyc_kyb_onboarding_customer_onboarding_exchange_customer_onboarding,Compliance layer,SFTY connects KYC,and KYB onboarding workflows,"SFTY integrates identity, corporate and risk provider outputs into unified onboarding workflows that streamline review, preserve audit trails and support regulatory due diligence for exchange compliance teams.",Orchestrate provider outputs,Apply risk rules and policies,Track regulatory rule updates,Build audit-ready evidence,Travel Rule,KYB,Screening,KYT,KYC,SFTY Compliance Control Layer,Cases,Decisions,Evidence,Reports
biz_kyc_kyb_onboarding_ubo_review_beneficial_ownership_review,Business solution,SFTY connects UBO,checks into workflow,"SFTY integrates KYC and KYB provider outputs, corporate data and risk rules into a unified onboarding workflow that streamlines beneficial ownership review and preserves audit-ready decision evidence.",Orchestrate provider outputs,Apply risk rules and policies,Track regulatory rule updates,Build audit-ready evidence,Travel Rule,KYB,Screening,KYT,KYC,SFTY Compliance Control Layer,Cases,Decisions,Evidence,Reports
biz_kyc_kyb_onboarding_customer_onboarding_payment_customer_onboarding,Provider orchestration,SFTY connects onboarding,outputs into workflows,"SFTY integrates KYC, KYB, sanctions, and screening provider results into a unified, risk-based onboarding workflow that centralizes decision logs and audit evidence for faster, more consistent reviews.",Orchestrate provider outputs,Apply risk rules and policies,Track regulatory rule updates,Build audit-ready evidence,Travel Rule,KYB,Screening,KYT,KYC,SFTY Compliance Control Layer,Cases,Decisions,Evidence,Reports
