biz_executive_risk_control_audit_defensibility_defensible_risk_reviews,Provider orchestration,SFTY gives executives,one operating view,"SFTY connects provider outputs, risk decisions, review history and audit evidence into a unified workflow that enhances visibility, traceability and defensible documentation for executive risk oversight.",Orchestrate provider outputs,Apply risk rules and policies,Track regulatory rule updates,Build audit-ready evidence,Travel Rule,KYB,Screening,KYT,KYC,SFTY Compliance Control Layer,Cases,Decisions,Evidence,Reports
biz_executive_risk_control_regulatory_readiness_inspection_readiness,Workflow control,SFTY gives executives,one compliance view,"SFTY centralizes compliance cases, evidence, provider outputs and decision history into a unified workflow giving executive teams transparent risk visibility and streamlined audit readiness for inspections.",Orchestrate provider outputs,Apply risk rules and policies,Track regulatory rule updates,Build audit-ready evidence,Travel Rule,KYB,Screening,KYT,KYC,SFTY Compliance Control Layer,Cases,Decisions,Evidence,Reports
biz_executive_risk_control_audit_defensibility_audit_defensibility,The SFTY approach,SFTY gives executives,one audit-ready view,"SFTY consolidates compliance decisions, case histories, and evidence across providers into a single operational layer so executives can access clear, traceable audit records supporting defensible compliance oversight.",Orchestrate provider outputs,Apply risk rules and policies,Track regulatory rule updates,Build audit-ready evidence,Travel Rule,KYB,Screening,KYT,KYC,SFTY Compliance Control Layer,Cases,Decisions,Evidence,Reports
biz_executive_risk_control_compliance_cost_control_provider_cost_visibility,Compliance layer,SFTY gives executives,one compliance operating view,"SFTY aggregates provider outputs, compliance costs, case workflows and audit evidence into a unified dashboard that empowers leadership with transparent oversight and scalable control over digital asset compliance.",Orchestrate provider outputs,Apply risk rules and policies,Track regulatory rule updates,Build audit-ready evidence,Travel Rule,KYB,Screening,KYT,KYC,SFTY Compliance Control Layer,Cases,Decisions,Evidence,Reports
biz_executive_risk_control_enterprise_control_layer_enterprise_case_control_layer,Business solution,SFTY gives leadership,one enterprise control layer,"SFTY consolidates case creation, ownership, escalation and audit evidence into a unified workflow that delivers clear operational oversight and decision traceability for VASP compliance leadership.",Orchestrate provider outputs,Apply risk rules and policies,Track regulatory rule updates,Build audit-ready evidence,Travel Rule,KYB,Screening,KYT,KYC,SFTY Compliance Control Layer,Cases,Decisions,Evidence,Reports
biz_executive_risk_control_operational_risk_alert_handling_risk,Provider orchestration,SFTY gives executives,one compliance view,"SFTY organizes alerts, case status, decision logs and evidence into a unified compliance operating layer, enabling executives to monitor risk, operational gaps and audit readiness in real time.",Orchestrate provider outputs,Apply risk rules and policies,Track regulatory rule updates,Build audit-ready evidence,Travel Rule,KYB,Screening,KYT,KYC,SFTY Compliance Control Layer,Cases,Decisions,Evidence,Reports
biz_executive_risk_control_governance_controls_risk_governance_controls,Workflow control,SFTY gives executives,one operating view,"SFTY connects customer profiles, wallets, transactions, rules and decisions into a unified compliance layer that delivers audit-ready risk visibility and governance controls across multi-jurisdictional operations.",Orchestrate provider outputs,Apply risk rules and policies,Track regulatory rule updates,Build audit-ready evidence,Travel Rule,KYB,Screening,KYT,KYC,SFTY Compliance Control Layer,Cases,Decisions,Evidence,Reports
biz_executive_risk_control_regulatory_readiness_evidence_readiness,The SFTY approach,SFTY connects audit,evidence to workflows,"SFTY links regulatory changes, internal rule updates and operational decisions into one auditable workflow so executives and compliance teams maintain clear, ready evidence for supervisory inspections and audits.",Orchestrate provider outputs,Apply risk rules and policies,Track regulatory rule updates,Build audit-ready evidence,Travel Rule,KYB,Screening,KYT,KYC,SFTY Compliance Control Layer,Cases,Decisions,Evidence,Reports
biz_executive_risk_control_audit_defensibility_defensible_provider_outputs,Compliance layer,SFTY gives executives,one compliance operating view,"SFTY connects provider outputs, decision logs, case evidence and regulatory updates into a unified workflow that supports clear audit readiness and enhances risk visibility for senior compliance teams.",Orchestrate provider outputs,Apply risk rules and policies,Track regulatory rule updates,Build audit-ready evidence,Travel Rule,KYB,Screening,KYT,KYC,SFTY Compliance Control Layer,Cases,Decisions,Evidence,Reports
biz_executive_risk_control_bank_due_diligence_bank_risk_questionnaire_support,Business solution,SFTY gives executives,one audit-ready view,"SFTY connects compliance data, provider outputs, case evidence and risk workflows into a unified operating layer so banks can respond to risk questionnaires with consistent, traceable and defensible documentation.",Orchestrate provider outputs,Apply risk rules and policies,Track regulatory rule updates,Build audit-ready evidence,Travel Rule,KYB,Screening,KYT,KYC,SFTY Compliance Control Layer,Cases,Decisions,Evidence,Reports
biz_executive_risk_control_bank_due_diligence_bank_due_diligence_for_executives,Provider orchestration,SFTY gives executives,one compliance view,"SFTY connects compliance workflows, provider outputs, case evidence and regulatory rule updates into a single operating layer that delivers audit-ready visibility for bank executive risk control.",Orchestrate provider outputs,Apply risk rules and policies,Track regulatory rule updates,Build audit-ready evidence,Travel Rule,KYB,Screening,KYT,KYC,SFTY Compliance Control Layer,Cases,Decisions,Evidence,Reports
biz_executive_risk_control_compliance_cost_control_compliance_operations_efficiency,Workflow control,SFTY provides one,compliance control layer,"SFTY unifies provider outputs, decision logs, case workflows and audit evidence into a single operating layer that delivers executives clear visibility into risk, controls and compliance activity.",Orchestrate provider outputs,Apply risk rules and policies,Track regulatory rule updates,Build audit-ready evidence,Travel Rule,KYB,Screening,KYT,KYC,SFTY Compliance Control Layer,Cases,Decisions,Evidence,Reports
biz_executive_risk_control_governance_controls_escalation_governance,The SFTY approach,SFTY governs escalation,workflows with audit trail,"SFTY establishes consistent escalation rules, assigns clear ownership, and preserves decision logs to give executives centralized visibility and a defensible audit trail for compliance case governance.",Orchestrate provider outputs,Apply risk rules and policies,Track regulatory rule updates,Build audit-ready evidence,Travel Rule,KYB,Screening,KYT,KYC,SFTY Compliance Control Layer,Cases,Decisions,Evidence,Reports
biz_executive_risk_control_governance_controls_governance_for_executives,Compliance layer,SFTY gives executives,one operating view,"SFTY consolidates provider outputs, case workflows, decision logs and evidence into a unified dashboard so executives can oversee compliance risk and governance with clear audit-ready visibility.",Orchestrate provider outputs,Apply risk rules and policies,Track regulatory rule updates,Build audit-ready evidence,Travel Rule,KYB,Screening,KYT,KYC,SFTY Compliance Control Layer,Cases,Decisions,Evidence,Reports
biz_executive_risk_control_bank_due_diligence_crypto_business_bank_review,Business solution,SFTY gives executives,one unified compliance view,"SFTY connects scattered compliance data, provider outputs, case workflows and audit evidence into a single operational layer that streamlines bank due diligence and enhances executive risk visibility.",Orchestrate provider outputs,Apply risk rules and policies,Track regulatory rule updates,Build audit-ready evidence,Travel Rule,KYB,Screening,KYT,KYC,SFTY Compliance Control Layer,Cases,Decisions,Evidence,Reports
biz_executive_risk_control_regulatory_readiness_regulatory_readiness_for_executives,Provider orchestration,SFTY gives executives,one compliance view,"SFTY organizes dispersed provider outputs, case decisions, regulatory updates and audit evidence into a unified operational layer that delivers risk visibility and readiness for executive oversight.",Orchestrate provider outputs,Apply risk rules and policies,Track regulatory rule updates,Build audit-ready evidence,Travel Rule,KYB,Screening,KYT,KYC,SFTY Compliance Control Layer,Cases,Decisions,Evidence,Reports
biz_executive_risk_control_operational_risk_reporting_risk,Workflow control,SFTY gives executives,one compliance operating view,"SFTY connects evidence, decision history, cases and provider outputs into a unified workflow that enhances reporting clarity, audit readiness and operational risk oversight for VASP leadership teams.",Orchestrate provider outputs,Apply risk rules and policies,Track regulatory rule updates,Build audit-ready evidence,Travel Rule,KYB,Screening,KYT,KYC,SFTY Compliance Control Layer,Cases,Decisions,Evidence,Reports
biz_executive_risk_control_bank_due_diligence_exchange_bank_due_diligence,The SFTY approach,SFTY gives executives,one audit-ready view,"SFTY connects compliance workflows, evidence packages, provider outputs and case histories into a unified operating layer that supports structured bank due diligence and executive risk oversight.",Orchestrate provider outputs,Apply risk rules and policies,Track regulatory rule updates,Build audit-ready evidence,Travel Rule,KYB,Screening,KYT,KYC,SFTY Compliance Control Layer,Cases,Decisions,Evidence,Reports
biz_executive_risk_control_regulatory_readiness_vasp_regulatory_readiness,Compliance layer,SFTY gives executives,one unified operating view,"SFTY consolidates provider data, compliance cases, decision logs and evidence into a single control layer so VASP leadership can monitor risk, audit readiness and regulatory workflows confidently.",Orchestrate provider outputs,Apply risk rules and policies,Track regulatory rule updates,Build audit-ready evidence,Travel Rule,KYB,Screening,KYT,KYC,SFTY Compliance Control Layer,Cases,Decisions,Evidence,Reports
biz_executive_risk_control_enterprise_control_layer_enterprise_audit_control_layer,Business solution,SFTY builds one,enterprise audit control layer,"SFTY centralizes decision logs, compliance evidence, and user actions into a unified control layer enabling executives to maintain clear oversight, streamline audit readiness, and reduce operational compliance risks at scale.",Orchestrate provider outputs,Apply risk rules and policies,Track regulatory rule updates,Build audit-ready evidence,Travel Rule,KYB,Screening,KYT,KYC,SFTY Compliance Control Layer,Cases,Decisions,Evidence,Reports
biz_executive_risk_control_operational_risk_compliance_operational_risk,Provider orchestration,SFTY gives executives,one audit-ready view,"SFTY consolidates provider outputs, case workflows, decision logs and evidence into a unified operational layer that improves visibility and strengthens audit readiness for executive risk control.",Orchestrate provider outputs,Apply risk rules and policies,Track regulatory rule updates,Build audit-ready evidence,Travel Rule,KYB,Screening,KYT,KYC,SFTY Compliance Control Layer,Cases,Decisions,Evidence,Reports
biz_executive_risk_control_compliance_cost_control_compliance_cost_control,Workflow control,SFTY gives executives,one operating view,"SFTY connects fragmented provider outputs, case workflows, risk signals and decision evidence into a unified compliance layer that improves visibility, audit readiness and operational control for leadership.",Orchestrate provider outputs,Apply risk rules and policies,Track regulatory rule updates,Build audit-ready evidence,Travel Rule,KYB,Screening,KYT,KYC,SFTY Compliance Control Layer,Cases,Decisions,Evidence,Reports
biz_executive_risk_control_risk_dashboard_onboarding_risk_dashboard,The SFTY approach,SFTY gives executives,one onboarding risk view,"SFTY unifies data from compliance providers, review queues, case workflows and risk signals into a single dashboard so leadership can track onboarding status and audit-ready risk exposure clearly.",Orchestrate provider outputs,Apply risk rules and policies,Track regulatory rule updates,Build audit-ready evidence,Travel Rule,KYB,Screening,KYT,KYC,SFTY Compliance Control Layer,Cases,Decisions,Evidence,Reports
biz_executive_risk_control_bank_due_diligence_bank_readiness_dashboard,Compliance layer,SFTY gives leaders,one compliance view,"SFTY connects dispersed bank onboarding, risk signals, regulatory rules and case evidence into a unified dashboard that enhances executive visibility and supports audit-ready due diligence reporting.",Orchestrate provider outputs,Apply risk rules and policies,Track regulatory rule updates,Build audit-ready evidence,Travel Rule,KYB,Screening,KYT,KYC,SFTY Compliance Control Layer,Cases,Decisions,Evidence,Reports
biz_executive_risk_control_risk_dashboard_kyt_risk_dashboard,Business solution,SFTY aggregates wallet,risk into one view,"SFTY connects wallet, transaction and alert data from multiple providers into a unified dashboard, giving executives clear, audit-ready visibility to manage and escalate KYT risk efficiently.",Orchestrate provider outputs,Apply risk rules and policies,Track regulatory rule updates,Build audit-ready evidence,Travel Rule,KYB,Screening,KYT,KYC,SFTY Compliance Control Layer,Cases,Decisions,Evidence,Reports
biz_executive_risk_control_enterprise_control_layer_enterprise_monitoring_control_layer,Provider orchestration,SFTY gives executives,one compliance operating view,"SFTY connects wallet, transaction and alert data with case workflows, decision logs and audit evidence into a unified, scalable layer that supports executive oversight and strategic compliance risk control.",Orchestrate provider outputs,Apply risk rules and policies,Track regulatory rule updates,Build audit-ready evidence,Travel Rule,KYB,Screening,KYT,KYC,SFTY Compliance Control Layer,Cases,Decisions,Evidence,Reports
biz_executive_risk_control_board_visibility_audit_readiness_visibility,Workflow control,SFTY gives executives,one unified operating view,"SFTY consolidates compliance workflows, audit evidence, case history and decision logs into a single dashboard so boards and risk leaders can track operational risk and audit readiness with clarity.",Orchestrate provider outputs,Apply risk rules and policies,Track regulatory rule updates,Build audit-ready evidence,Travel Rule,KYB,Screening,KYT,KYC,SFTY Compliance Control Layer,Cases,Decisions,Evidence,Reports
biz_executive_risk_control_board_visibility_executive_compliance_visibility,The SFTY approach,SFTY gives executives,one compliance view,"SFTY consolidates provider outputs, case workflows, decision logs and audit evidence into a unified dashboard that delivers clear visibility and risk control for VASP leadership teams.",Orchestrate provider outputs,Apply risk rules and policies,Track regulatory rule updates,Build audit-ready evidence,Travel Rule,KYB,Screening,KYT,KYC,SFTY Compliance Control Layer,Cases,Decisions,Evidence,Reports
biz_executive_risk_control_regulatory_readiness_regulator_request_readiness,Compliance layer,SFTY gives executives,one audit-ready view,"SFTY connects compliance data, case evidence, provider outputs and review history into a unified operating layer, enabling leadership to deliver transparent and traceable responses to regulator requests efficiently.",Orchestrate provider outputs,Apply risk rules and policies,Track regulatory rule updates,Build audit-ready evidence,Travel Rule,KYB,Screening,KYT,KYC,SFTY Compliance Control Layer,Cases,Decisions,Evidence,Reports
biz_executive_risk_control_governance_controls_compliance_governance_controls,Business solution,SFTY gives executives,one governance control layer,"SFTY unifies provider outputs, case decisions, evidence and regulatory updates into a single operating layer that delivers executives clear, audit-ready visibility across compliance workflows and risk governance.",Orchestrate provider outputs,Apply risk rules and policies,Track regulatory rule updates,Build audit-ready evidence,Travel Rule,KYB,Screening,KYT,KYC,SFTY Compliance Control Layer,Cases,Decisions,Evidence,Reports
biz_executive_risk_control_risk_dashboard_case_risk_dashboard,Provider orchestration,SFTY gives executives,one consolidated view,"SFTY aggregates case risk data by severity, ownership and status into a unified dashboard, enabling leadership to track operational risk clearly and maintain oversight for audit and regulatory readiness.",Orchestrate provider outputs,Apply risk rules and policies,Track regulatory rule updates,Build audit-ready evidence,Travel Rule,KYB,Screening,KYT,KYC,SFTY Compliance Control Layer,Cases,Decisions,Evidence,Reports
biz_executive_risk_control_risk_dashboard_audit_readiness_dashboard,Workflow control,SFTY gives executives,one audit-ready view,"SFTY consolidates audit evidence, review logs and case history from multiple compliance systems into a unified operating dashboard to support clear risk oversight and stronger regulatory defensibility.",Orchestrate provider outputs,Apply risk rules and policies,Track regulatory rule updates,Build audit-ready evidence,Travel Rule,KYB,Screening,KYT,KYC,SFTY Compliance Control Layer,Cases,Decisions,Evidence,Reports
biz_executive_risk_control_compliance_cost_control_cost_of_false_positives,The SFTY approach,SFTY reduces false positives,through audit-ready workflows,"SFTY connects alert signals, provider checks and case management into one operational workflow that reduces manual reviews while preserving audit evidence for clearer executive risk visibility.",Orchestrate provider outputs,Apply risk rules and policies,Track regulatory rule updates,Build audit-ready evidence,Travel Rule,KYB,Screening,KYT,KYC,SFTY Compliance Control Layer,Cases,Decisions,Evidence,Reports
biz_executive_risk_control_audit_defensibility_audit_defensibility_dashboard,Compliance layer,SFTY gives executives,one operating view,"SFTY unifies compliance data, risk signals, case status, decision logs and audit evidence into a single dashboard, enabling leadership to monitor risk and defensibility across all workflows with clear operational insight.",Orchestrate provider outputs,Apply risk rules and policies,Track regulatory rule updates,Build audit-ready evidence,Travel Rule,KYB,Screening,KYT,KYC,SFTY Compliance Control Layer,Cases,Decisions,Evidence,Reports
biz_executive_risk_control_board_visibility_board_visibility_for_vasps,Business solution,SFTY gives boards,one compliance view,"SFTY consolidates provider data, compliance cases, rule updates and audit evidence into a single operating layer so VASP executives gain clear visibility and control across compliance workflows.",Orchestrate provider outputs,Apply risk rules and policies,Track regulatory rule updates,Build audit-ready evidence,Travel Rule,KYB,Screening,KYT,KYC,SFTY Compliance Control Layer,Cases,Decisions,Evidence,Reports
biz_executive_risk_control_regulatory_readiness_regulatory_readiness,Provider orchestration,SFTY gives executives,one unified operating view,"SFTY connects regulatory updates, provider outputs, case evidence and workflows into a single control layer so leadership teams can oversee compliance risk with clearer visibility and audit readiness.",Orchestrate provider outputs,Apply risk rules and policies,Track regulatory rule updates,Build audit-ready evidence,Travel Rule,KYB,Screening,KYT,KYC,SFTY Compliance Control Layer,Cases,Decisions,Evidence,Reports
biz_executive_risk_control_board_visibility_board_compliance_visibility,Workflow control,SFTY gives boards,one compliance view,"SFTY centralizes provider data, risk signals, case status and audit evidence into a single operating view so executives and boards can monitor compliance workflows with clear oversight and decision confidence.",Orchestrate provider outputs,Apply risk rules and policies,Track regulatory rule updates,Build audit-ready evidence,Travel Rule,KYB,Screening,KYT,KYC,SFTY Compliance Control Layer,Cases,Decisions,Evidence,Reports
biz_executive_risk_control_board_visibility_risk_exposure_visibility,The SFTY approach,SFTY gives executives,one operating view,"SFTY consolidates data from onboarding, monitoring, alerts and case workflows into a unified control layer that delivers clear, auditable risk exposure insights for leadership decision-making.",Orchestrate provider outputs,Apply risk rules and policies,Track regulatory rule updates,Build audit-ready evidence,Travel Rule,KYB,Screening,KYT,KYC,SFTY Compliance Control Layer,Cases,Decisions,Evidence,Reports
biz_executive_risk_control_compliance_cost_control_compliance_cost_reduction,Compliance layer,SFTY connects compliance,operations into one view,"SFTY integrates provider outputs, case workflows, decision logs and audit evidence into a unified operating layer that reduces duplication and gives executives clear visibility across compliance processes.",Orchestrate provider outputs,Apply risk rules and policies,Track regulatory rule updates,Build audit-ready evidence,Travel Rule,KYB,Screening,KYT,KYC,SFTY Compliance Control Layer,Cases,Decisions,Evidence,Reports
biz_executive_risk_control_governance_controls_aml_governance_controls,Business solution,SFTY creates unified,AML governance controls,"SFTY structures AML decision workflows, escalation paths and reporting evidence into one connected control layer to give executives clear operational visibility and stronger audit readiness.",Orchestrate provider outputs,Apply risk rules and policies,Track regulatory rule updates,Build audit-ready evidence,Travel Rule,KYB,Screening,KYT,KYC,SFTY Compliance Control Layer,Cases,Decisions,Evidence,Reports
biz_executive_risk_control_risk_dashboard_compliance_risk_dashboard,Provider orchestration,SFTY gives executives,one operating view,"SFTY consolidates onboarding, monitoring, case workflows, alerts, and provider outputs into a unified compliance dashboard to deliver executives clear visibility and stronger audit evidence for risk oversight.",Orchestrate provider outputs,Apply risk rules and policies,Track regulatory rule updates,Build audit-ready evidence,Travel Rule,KYB,Screening,KYT,KYC,SFTY Compliance Control Layer,Cases,Decisions,Evidence,Reports
biz_executive_risk_control_enterprise_control_layer_enterprise_onboarding_control_layer,Workflow control,SFTY creates unified,onboarding control layer,"SFTY connects onboarding data from multiple providers into one operational workflow that gives executives clear visibility into customer risk, case status, decision records and audit-ready evidence.",Orchestrate provider outputs,Apply risk rules and policies,Track regulatory rule updates,Build audit-ready evidence,Travel Rule,KYB,Screening,KYT,KYC,SFTY Compliance Control Layer,Cases,Decisions,Evidence,Reports
biz_executive_risk_control_risk_dashboard_executive_risk_dashboard,The SFTY approach,SFTY gives executives,one compliance dashboard,"SFTY consolidates risk signals, provider outputs, case statuses and audit evidence into a unified dashboard to give leadership clear, timely visibility and control over enterprise compliance operations.",Orchestrate provider outputs,Apply risk rules and policies,Track regulatory rule updates,Build audit-ready evidence,Travel Rule,KYB,Screening,KYT,KYC,SFTY Compliance Control Layer,Cases,Decisions,Evidence,Reports
biz_executive_risk_control_scaling_without_chaos_scaling_alert_operations,Compliance layer,SFTY scales alert,routing and cases,"SFTY connects alert prioritization, case management, reviewer actions and decision logs into one streamlined workflow that gives executives clear visibility into compliance risk and operational status.",Orchestrate provider outputs,Apply risk rules and policies,Track regulatory rule updates,Build audit-ready evidence,Travel Rule,KYB,Screening,KYT,KYC,SFTY Compliance Control Layer,Cases,Decisions,Evidence,Reports
biz_executive_risk_control_governance_controls_role_based_governance,Business solution,SFTY enforces role-based,governance controls,"SFTY structures access permissions, task assignments and decision logs into one auditable control layer empowering leadership with clear accountability and operational visibility across VASP compliance workflows.",Orchestrate provider outputs,Apply risk rules and policies,Track regulatory rule updates,Build audit-ready evidence,Travel Rule,KYB,Screening,KYT,KYC,SFTY Compliance Control Layer,Cases,Decisions,Evidence,Reports
biz_executive_risk_control_enterprise_control_layer_sfty_enterprise_control_layer,Provider orchestration,SFTY gives executives,one compliance view,"SFTY consolidates provider outputs, regulatory rules, case workflows and audit evidence into a single operating layer that delivers clear risk visibility and decision support for executive teams.",Orchestrate provider outputs,Apply risk rules and policies,Track regulatory rule updates,Build audit-ready evidence,Travel Rule,KYB,Screening,KYT,KYC,SFTY Compliance Control Layer,Cases,Decisions,Evidence,Reports
