biz_provider_fragmentation_disconnected_checks_disconnected_kyb_checks,Workflow control,SFTY links KYB,checks to entity risk,"SFTY connects KYB provider outputs with corporate records, entity risk assessments and compliance case workflows to streamline reviews, reduce duplication and maintain a clear audit trail for onboarding and monitoring.",Orchestrate provider outputs,Apply risk rules and policies,Track regulatory rule updates,Build audit-ready evidence,Travel Rule,KYB,Screening,KYT,KYC,SFTY Compliance Control Layer,Cases,Decisions,Evidence,Reports
biz_provider_fragmentation_data_silos_kyb_data_silos,The SFTY approach,SFTY connects KYB,data into workflows,"SFTY integrates fragmented KYB outputs, entity risk data, ownership details and review actions into one structured workflow that streamlines case management, supports audit evidence and reduces manual handoffs for VASP compliance teams.",Orchestrate provider outputs,Apply risk rules and policies,Track regulatory rule updates,Build audit-ready evidence,Travel Rule,KYB,Screening,KYT,KYC,SFTY Compliance Control Layer,Cases,Decisions,Evidence,Reports
biz_provider_fragmentation_fragmented_risk_profile_entity_360_risk_view,Compliance layer,SFTY connects fragmented,risk profiles to cases,"SFTY consolidates KYB, wallet risk, transaction data and provider outputs into unified case workflows, enabling compliance teams to build audit-ready 360-degree entity risk views with clear operational context.",Orchestrate provider outputs,Apply risk rules and policies,Track regulatory rule updates,Build audit-ready evidence,Travel Rule,KYB,Screening,KYT,KYC,SFTY Compliance Control Layer,Cases,Decisions,Evidence,Reports
biz_provider_fragmentation_vendor_chaos_vendor_neutral_compliance_layer,Business solution,SFTY connects provider,outputs into workflow,"SFTY integrates diverse compliance provider outputs into a unified workflow that streamlines onboarding, case management, decision tracking and audit evidence for faster, consistent and defensible compliance operations.",Orchestrate provider outputs,Apply risk rules and policies,Track regulatory rule updates,Build audit-ready evidence,Travel Rule,KYB,Screening,KYT,KYC,SFTY Compliance Control Layer,Cases,Decisions,Evidence,Reports
biz_provider_fragmentation_provider_output_normalization_kyb_output_normalization,Provider orchestration,SFTY normalizes KYB,outputs into workflows,"SFTY aggregates and harmonizes fragmented KYB data from multiple providers into consistent case workflows that link company ownership, verification actions and audit evidence for efficient onboarding and review.",Orchestrate provider outputs,Apply risk rules and policies,Track regulatory rule updates,Build audit-ready evidence,Travel Rule,KYB,Screening,KYT,KYC,SFTY Compliance Control Layer,Cases,Decisions,Evidence,Reports
biz_provider_fragmentation_policy_inconsistency_policy_inconsistency,Workflow control,SFTY enforces policy,consistency across workflows,"SFTY connects provider outputs, internal rules and case workflows to support consistent policy application, reduce duplicated reviews and preserve a clear audit trail for VASP compliance operations.",Orchestrate provider outputs,Apply risk rules and policies,Track regulatory rule updates,Build audit-ready evidence,Travel Rule,KYB,Screening,KYT,KYC,SFTY Compliance Control Layer,Cases,Decisions,Evidence,Reports
biz_provider_fragmentation_duplicate_reviews_duplicate_alert_reviews,The SFTY approach,SFTY consolidates alert,queues into cases,"SFTY connects overlapping provider alerts, aggregates related data, and structures them into unified cases with complete evidence and decision logs to streamline compliance workflows and reduce manual duplicate reviews.",Orchestrate provider outputs,Apply risk rules and policies,Track regulatory rule updates,Build audit-ready evidence,Travel Rule,KYB,Screening,KYT,KYC,SFTY Compliance Control Layer,Cases,Decisions,Evidence,Reports
biz_provider_fragmentation_provider_output_normalization_kyt_score_normalization,Compliance layer,SFTY normalizes,KYT scores and signals,"SFTY aggregates outputs from multiple blockchain analytics providers and standardizes risk scores into one unified workflow so operations teams can efficiently review wallet risk with consistent, audit-ready evidence.",Orchestrate provider outputs,Apply risk rules and policies,Track regulatory rule updates,Build audit-ready evidence,Travel Rule,KYB,Screening,KYT,KYC,SFTY Compliance Control Layer,Cases,Decisions,Evidence,Reports
biz_provider_fragmentation_vendor_chaos_compliance_vendor_chaos,Business solution,SFTY connects compliance,vendor outputs into workflow,"SFTY centralizes disparate provider results, customer data, wallet risk and case actions into one unified compliance workflow that streamlines review, preserves audit evidence and supports regulatory reporting for VASPs.",Orchestrate provider outputs,Apply risk rules and policies,Track regulatory rule updates,Build audit-ready evidence,Travel Rule,KYB,Screening,KYT,KYC,SFTY Compliance Control Layer,Cases,Decisions,Evidence,Reports
biz_provider_fragmentation_data_silos_data_silo_integration,Provider orchestration,SFTY connects fragmented,compliance data silos,"SFTY integrates KYC, KYB, KYT, Travel Rule, screening, case data and reporting into a unified workflow that consolidates provider outputs, automates review routing and preserves audit evidence for compliance teams.",Orchestrate provider outputs,Apply risk rules and policies,Track regulatory rule updates,Build audit-ready evidence,Travel Rule,KYB,Screening,KYT,KYC,SFTY Compliance Control Layer,Cases,Decisions,Evidence,Reports
biz_provider_fragmentation_fragmented_risk_profile_fragmented_counterparty_risk_profile,Workflow control,SFTY unifies fragmented,counterparty risk profiles,"SFTY consolidates screening results, KYB checks and transaction signals into one compliance operating layer that structures case workflows and preserves audit evidence for VASP compliance teams.",Orchestrate provider outputs,Apply risk rules and policies,Track regulatory rule updates,Build audit-ready evidence,Travel Rule,KYB,Screening,KYT,KYC,SFTY Compliance Control Layer,Cases,Decisions,Evidence,Reports
biz_provider_fragmentation_policy_inconsistency_policy_to_workflow_gap,The SFTY approach,SFTY bridges policy,to compliance workflow,"SFTY creates one unified layer that connects compliance policies, provider outputs and case workflows into a single operational system for consistent, auditable and scalable compliance decisions.",Orchestrate provider outputs,Apply risk rules and policies,Track regulatory rule updates,Build audit-ready evidence,Travel Rule,KYB,Screening,KYT,KYC,SFTY Compliance Control Layer,Cases,Decisions,Evidence,Reports
biz_provider_fragmentation_duplicate_reviews_duplicate_provider_checks,Compliance layer,SFTY consolidates,duplicate provider checks,"SFTY integrates outputs from multiple KYC, KYB, and screening providers into a single compliance workflow, reducing duplicated reviews and creating a unified audit trail for faster, clearer operational risk management.",Orchestrate provider outputs,Apply risk rules and policies,Track regulatory rule updates,Build audit-ready evidence,Travel Rule,KYB,Screening,KYT,KYC,SFTY Compliance Control Layer,Cases,Decisions,Evidence,Reports
biz_provider_fragmentation_manual_handoffs_onboarding_to_monitoring_handoffs,Business solution,SFTY links onboarding,to monitoring workflows,"SFTY connects onboarding outputs with ongoing monitoring data, consolidating provider checks, case reviews and decision logs into a continuous workflow to improve risk visibility and maintain a strong audit trail.",Orchestrate provider outputs,Apply risk rules and policies,Track regulatory rule updates,Build audit-ready evidence,Travel Rule,KYB,Screening,KYT,KYC,SFTY Compliance Control Layer,Cases,Decisions,Evidence,Reports
biz_provider_fragmentation_manual_handoffs_kyc_to_kyt_handoffs,Provider orchestration,SFTY connects KYC,outputs to KYT workflows,"SFTY links onboarding checks with wallet risk and transaction monitoring results to create one continuous, auditable compliance workflow that reduces manual handoffs and preserves risk context for operations teams.",Orchestrate provider outputs,Apply risk rules and policies,Track regulatory rule updates,Build audit-ready evidence,Travel Rule,KYB,Screening,KYT,KYC,SFTY Compliance Control Layer,Cases,Decisions,Evidence,Reports
biz_provider_fragmentation_unified_control_layer_unified_monitoring_control_layer,Workflow control,SFTY connects provider,outputs into workflow,"SFTY integrates KYC, KYB, KYT, Travel Rule and screening data into one unified workflow, enabling compliance teams to track alerts, manage cases and preserve audit evidence through a single control layer.",Orchestrate provider outputs,Apply risk rules and policies,Track regulatory rule updates,Build audit-ready evidence,Travel Rule,KYB,Screening,KYT,KYC,SFTY Compliance Control Layer,Cases,Decisions,Evidence,Reports
biz_provider_fragmentation_unified_control_layer_unified_case_control_layer,The SFTY approach,SFTY connects provider,outputs into workflow,"SFTY connects fragmented provider outputs with case routing, decision logs and evidence tracking to give compliance teams one unified workflow for managing cases, escalations and audit-ready review.",Orchestrate provider outputs,Apply risk rules and policies,Track regulatory rule updates,Build audit-ready evidence,Travel Rule,KYB,Screening,KYT,KYC,SFTY Compliance Control Layer,Cases,Decisions,Evidence,Reports
biz_provider_fragmentation_data_silos_screening_data_silos,Compliance layer,SFTY connects screening,data into cases,"SFTY integrates sanctions, PEP and adverse media screening outputs with risk profiles, case management and escalation workflows to create a unified, auditable compliance operating layer for VASP teams.",Orchestrate provider outputs,Apply risk rules and policies,Track regulatory rule updates,Build audit-ready evidence,Travel Rule,KYB,Screening,KYT,KYC,SFTY Compliance Control Layer,Cases,Decisions,Evidence,Reports
biz_provider_fragmentation_unified_control_layer_compliance_operating_layer,Business solution,SFTY connects fragmented,outputs into workflow,"SFTY integrates provider results, customer data, wallet activity and case management into one compliance operating layer, enabling faster onboarding, consistent decisions and a clear audit trail for compliance teams.",Orchestrate provider outputs,Apply risk rules and policies,Track regulatory rule updates,Build audit-ready evidence,Travel Rule,KYB,Screening,KYT,KYC,SFTY Compliance Control Layer,Cases,Decisions,Evidence,Reports
biz_provider_fragmentation_manual_handoffs_manual_compliance_handoffs,Provider orchestration,SFTY connects provider,outputs into workflow,"SFTY integrates disparate provider checks, manual reviews, decision logs and evidence into a single workflow enabling compliance teams to reduce handoffs, improve traceability and maintain a consistent audit trail.",Orchestrate provider outputs,Apply risk rules and policies,Track regulatory rule updates,Build audit-ready evidence,Travel Rule,KYB,Screening,KYT,KYC,SFTY Compliance Control Layer,Cases,Decisions,Evidence,Reports
biz_provider_fragmentation_vendor_chaos_vendor_coordination_workflow,Workflow control,SFTY connects provider,outputs into workflow,"SFTY integrates KYC, KYB, KYT, Travel Rule, and screening outputs into a unified workflow that routes reviews, preserves audit evidence, and centralizes case management for VASP compliance teams.",Orchestrate provider outputs,Apply risk rules and policies,Track regulatory rule updates,Build audit-ready evidence,Travel Rule,KYB,Screening,KYT,KYC,SFTY Compliance Control Layer,Cases,Decisions,Evidence,Reports
biz_provider_fragmentation_disconnected_checks_disconnected_evidence,The SFTY approach,SFTY preserves audit,evidence across providers,"SFTY connects KYC, KYB, KYT, Travel Rule and case management data into one unified workflow that preserves review history and supporting evidence for clearer audit readiness and operational traceability.",Orchestrate provider outputs,Apply risk rules and policies,Track regulatory rule updates,Build audit-ready evidence,Travel Rule,KYB,Screening,KYT,KYC,SFTY Compliance Control Layer,Cases,Decisions,Evidence,Reports
biz_provider_fragmentation_manual_handoffs_manual_review_bottlenecks,Compliance layer,SFTY connects fragmented,provider outputs into workflow,"SFTY integrates disparate provider checks, review actions, decision logs and evidence into one structured compliance workflow that reduces manual handoffs and accelerates onboarding for VASP operations teams.",Orchestrate provider outputs,Apply risk rules and policies,Track regulatory rule updates,Build audit-ready evidence,Travel Rule,KYB,Screening,KYT,KYC,SFTY Compliance Control Layer,Cases,Decisions,Evidence,Reports
biz_provider_fragmentation_fragmented_risk_profile_risk_profile_audit_trail,Business solution,SFTY preserves risk,profile audit trail,"SFTY captures and links risk profile updates, provider outputs, decisions and reviewer actions into one auditable workflow so VASP compliance teams maintain clear traceability and defendable evidence.",Orchestrate provider outputs,Apply risk rules and policies,Track regulatory rule updates,Build audit-ready evidence,Travel Rule,KYB,Screening,KYT,KYC,SFTY Compliance Control Layer,Cases,Decisions,Evidence,Reports
biz_provider_fragmentation_multiple_dashboards_kyt_dashboard_fragmentation,Provider orchestration,SFTY connects wallet,risk into workflow,"SFTY aggregates KYT alerts, wallet data and provider outputs into a unified workflow that centralizes risk context, case management and audit-ready evidence for VASP compliance teams.",Orchestrate provider outputs,Apply risk rules and policies,Track regulatory rule updates,Build audit-ready evidence,Travel Rule,KYB,Screening,KYT,KYC,SFTY Compliance Control Layer,Cases,Decisions,Evidence,Reports
biz_provider_fragmentation_multiple_dashboards_alert_dashboard_overload,Workflow control,SFTY connects alert,outputs into workflow,"SFTY consolidates fragmented provider alerts, links risk signals with case workflows, reviewer actions and audit evidence, enabling VASP compliance teams to manage alert triage efficiently within one operational system.",Orchestrate provider outputs,Apply risk rules and policies,Track regulatory rule updates,Build audit-ready evidence,Travel Rule,KYB,Screening,KYT,KYC,SFTY Compliance Control Layer,Cases,Decisions,Evidence,Reports
biz_provider_fragmentation_unified_control_layer_unified_audit_control_layer,The SFTY approach,SFTY creates one,compliance control layer,"SFTY centralizes provider outputs, decision logs, evidence and case data into a unified workflow so compliance teams can maintain clear audit trails and manage review actions efficiently.",Orchestrate provider outputs,Apply risk rules and policies,Track regulatory rule updates,Build audit-ready evidence,Travel Rule,KYB,Screening,KYT,KYC,SFTY Compliance Control Layer,Cases,Decisions,Evidence,Reports
biz_provider_fragmentation_unified_control_layer_unified_workflow_control_layer,Compliance layer,SFTY connects fragmented,provider outputs into workflow,"SFTY organizes disparate provider data, risk signals, and review actions into one unified workflow layer, enabling VASP compliance teams to manage decisions, evidence, and regulatory review readiness with greater speed and audit readiness.",Orchestrate provider outputs,Apply risk rules and policies,Track regulatory rule updates,Build audit-ready evidence,Travel Rule,KYB,Screening,KYT,KYC,SFTY Compliance Control Layer,Cases,Decisions,Evidence,Reports
biz_provider_fragmentation_vendor_chaos_vendor_switching_risk,Business solution,SFTY connects vendor,outputs into unified workflows,"SFTY integrates multiple compliance provider results into a single operational layer that structures onboarding, case management, evidence and reporting for VASPs facing vendor switching challenges.",Orchestrate provider outputs,Apply risk rules and policies,Track regulatory rule updates,Build audit-ready evidence,Travel Rule,KYB,Screening,KYT,KYC,SFTY Compliance Control Layer,Cases,Decisions,Evidence,Reports
biz_provider_fragmentation_policy_inconsistency_policy_execution_audit_trail,Provider orchestration,SFTY preserves policy,execution audit trail,"SFTY consolidates provider outputs, policy rules, reviewer decisions and evidence into one traceable workflow that helps VASPs maintain consistent audit trails and improve compliance decision transparency.",Orchestrate provider outputs,Apply risk rules and policies,Track regulatory rule updates,Build audit-ready evidence,Travel Rule,KYB,Screening,KYT,KYC,SFTY Compliance Control Layer,Cases,Decisions,Evidence,Reports
biz_provider_fragmentation_disconnected_checks_disconnected_screening_checks,Workflow control,SFTY connects screening,outputs to risk profiles,"SFTY integrates screening results with customer and counterparty data into one operational workflow, enabling VASP compliance teams to reduce manual handoffs, improve review speed and maintain audit-ready evidence.",Orchestrate provider outputs,Apply risk rules and policies,Track regulatory rule updates,Build audit-ready evidence,Travel Rule,KYB,Screening,KYT,KYC,SFTY Compliance Control Layer,Cases,Decisions,Evidence,Reports
biz_provider_fragmentation_data_silos_compliance_data_silos,The SFTY approach,SFTY connects compliance,data into workflow,"SFTY unifies fragmented KYC, KYB, KYT, Travel Rule, and screening outputs into a single operational workflow, enabling compliance teams to streamline reviews, maintain audit evidence, and support consistent decision-making.",Orchestrate provider outputs,Apply risk rules and policies,Track regulatory rule updates,Build audit-ready evidence,Travel Rule,KYB,Screening,KYT,KYC,SFTY Compliance Control Layer,Cases,Decisions,Evidence,Reports
biz_provider_fragmentation_duplicate_reviews_review_duplication_cost,Compliance layer,SFTY connects fragmented,provider outputs into workflow,"SFTY consolidates KYC, KYB, KYT and Travel Rule results into a unified compliance workflow that reduces duplicated reviews, preserves audit evidence and accelerates onboarding and case resolution.",Orchestrate provider outputs,Apply risk rules and policies,Track regulatory rule updates,Build audit-ready evidence,Travel Rule,KYB,Screening,KYT,KYC,SFTY Compliance Control Layer,Cases,Decisions,Evidence,Reports
biz_provider_fragmentation_data_silos_kyt_data_silos,Business solution,SFTY connects KYT,data with wallet context,"SFTY links KYT risk signals, wallet activity, transactions and customer profiles into one audit-ready workflow enabling VASP compliance teams to assess risk with clearer context and stronger evidence.",Orchestrate provider outputs,Apply risk rules and policies,Track regulatory rule updates,Build audit-ready evidence,Travel Rule,KYB,Screening,KYT,KYC,SFTY Compliance Control Layer,Cases,Decisions,Evidence,Reports
biz_provider_fragmentation_vendor_chaos_too_many_compliance_vendors,Provider orchestration,SFTY connects vendor,outputs into workflow,"SFTY integrates disparate compliance provider results into a unified operating layer that streamlines onboarding, risk reviews, case management and audit evidence for VASP compliance teams.",Orchestrate provider outputs,Apply risk rules and policies,Track regulatory rule updates,Build audit-ready evidence,Travel Rule,KYB,Screening,KYT,KYC,SFTY Compliance Control Layer,Cases,Decisions,Evidence,Reports
biz_provider_fragmentation_policy_inconsistency_inconsistent_kyc_rules,Workflow control,SFTY unifies KYC,rules into workflow,"SFTY links multiple KYC provider outputs, internal policies and reviewer actions into one consistent onboarding workflow that enforces uniform rules and preserves audit-ready evidence for VASP compliance teams.",Orchestrate provider outputs,Apply risk rules and policies,Track regulatory rule updates,Build audit-ready evidence,Travel Rule,KYB,Screening,KYT,KYC,SFTY Compliance Control Layer,Cases,Decisions,Evidence,Reports
biz_provider_fragmentation_disconnected_checks_disconnected_kyt_checks,The SFTY approach,SFTY connects KYT,checks to wallets,"SFTY unifies KYT alerts with wallet and transaction data across providers into one workflow, enabling compliance teams to manage cases with complete risk context and a clear audit trail.",Orchestrate provider outputs,Apply risk rules and policies,Track regulatory rule updates,Build audit-ready evidence,Travel Rule,KYB,Screening,KYT,KYC,SFTY Compliance Control Layer,Cases,Decisions,Evidence,Reports
biz_provider_fragmentation_disconnected_checks_disconnected_risk_signals,Compliance layer,SFTY connects provider,outputs into decision context,"SFTY combines fragmented KYC, KYB, KYT and Travel Rule results into a unified workflow that supports consistent review, case management and audit-ready evidence for VASP compliance teams.",Orchestrate provider outputs,Apply risk rules and policies,Track regulatory rule updates,Build audit-ready evidence,Travel Rule,KYB,Screening,KYT,KYC,SFTY Compliance Control Layer,Cases,Decisions,Evidence,Reports
biz_provider_fragmentation_fragmented_risk_profile_fragmented_provider_signals,Business solution,SFTY connects fragmented,provider signals into workflow,"SFTY consolidates disparate provider outputs, risk signals and review actions into a unified compliance workflow that strengthens audit trails and accelerates case management for VASP operations.",Orchestrate provider outputs,Apply risk rules and policies,Track regulatory rule updates,Build audit-ready evidence,Travel Rule,KYB,Screening,KYT,KYC,SFTY Compliance Control Layer,Cases,Decisions,Evidence,Reports
biz_provider_fragmentation_multiple_dashboards_kyc_dashboard_fragmentation,Provider orchestration,SFTY unifies KYC,checks into workflow,"SFTY connects fragmented KYC provider outputs, identity data and review actions into one case management workflow, enabling compliance teams to accelerate onboarding and maintain a clear, audit-ready evidence trail.",Orchestrate provider outputs,Apply risk rules and policies,Track regulatory rule updates,Build audit-ready evidence,Travel Rule,KYB,Screening,KYT,KYC,SFTY Compliance Control Layer,Cases,Decisions,Evidence,Reports
biz_provider_fragmentation_disconnected_checks_disconnected_travel_rule_checks,Workflow control,SFTY connects Travel Rule,checks into workflow,"SFTY integrates Travel Rule messages, exception handling, case creation, decision logs and audit evidence into one connected compliance workflow for VASP operations teams to reduce manual effort and improve review traceability.",Orchestrate provider outputs,Apply risk rules and policies,Track regulatory rule updates,Build audit-ready evidence,Travel Rule,KYB,Screening,KYT,KYC,SFTY Compliance Control Layer,Cases,Decisions,Evidence,Reports
biz_provider_fragmentation_unified_control_layer_sfty_control_layer,The SFTY approach,SFTY connects fragmented,provider outputs into workflow,"SFTY integrates KYC, KYB, KYT, Travel Rule, and screening results into a unified compliance workflow that streamlines review, centralizes decisions, and preserves audit-ready evidence for VASP operations.",Orchestrate provider outputs,Apply risk rules and policies,Track regulatory rule updates,Build audit-ready evidence,Travel Rule,KYB,Screening,KYT,KYC,SFTY Compliance Control Layer,Cases,Decisions,Evidence,Reports
biz_provider_fragmentation_data_silos_case_management_data_silos,Compliance layer,SFTY connects case,management to provider outputs,"SFTY integrates case workflows with KYC, KYB, KYT and Travel Rule provider data into a unified operating layer that streamlines reviews and preserves audit evidence for compliance teams.",Orchestrate provider outputs,Apply risk rules and policies,Track regulatory rule updates,Build audit-ready evidence,Travel Rule,KYB,Screening,KYT,KYC,SFTY Compliance Control Layer,Cases,Decisions,Evidence,Reports
biz_provider_fragmentation_policy_inconsistency_inconsistent_review_decisions,Business solution,SFTY structures case,workflows for consistency,"SFTY connects fragmented provider outputs, policy enforcement data, reviewer actions and evidence into a single workflow that reduces duplicated checks and strengthens audit trails for consistent compliance decisions.",Orchestrate provider outputs,Apply risk rules and policies,Track regulatory rule updates,Build audit-ready evidence,Travel Rule,KYB,Screening,KYT,KYC,SFTY Compliance Control Layer,Cases,Decisions,Evidence,Reports
biz_provider_fragmentation_multiple_dashboards_multi_provider_dashboard_workflow,Provider orchestration,SFTY connects multiple,provider outputs into workflow,"SFTY integrates KYC, KYB, KYT, Travel Rule and screening provider data into one structured compliance workflow, enabling operational teams to manage cases, decisions and audit evidence with full risk context and traceability.",Orchestrate provider outputs,Apply risk rules and policies,Track regulatory rule updates,Build audit-ready evidence,Travel Rule,KYB,Screening,KYT,KYC,SFTY Compliance Control Layer,Cases,Decisions,Evidence,Reports
biz_provider_fragmentation_multiple_dashboards_dashboard_audit_gaps,Workflow control,SFTY unifies scattered,provider data workflows,"SFTY connects fragmented provider outputs, reviewer actions, decision logs and evidence into a single workflow that strengthens audit traceability and accelerates case reconstruction for compliance teams.",Orchestrate provider outputs,Apply risk rules and policies,Track regulatory rule updates,Build audit-ready evidence,Travel Rule,KYB,Screening,KYT,KYC,SFTY Compliance Control Layer,Cases,Decisions,Evidence,Reports
